{
  "event_id": "evt-001",
  "timestamp": "2026-08-18T15:30:00Z",
  "subject": {
    "id": "user-123",
    "roles": ["manager"]
  },
  "action": "read",
  "resource": {
    "id": "complaint-456",
    "type": "employee_complaint",
    "classification": "restricted"
  },
  "policy": {
    "name": "employee_complaint_access",
    "version": "1.0"
  },
  "decision": {
    "allowed": false,
    "status": "DENY",
    "reasons": [
      "Restricted employee complaint data requires HR Investigator role"
    ]
  }
}